{"$schema": "./schema.json", "instanceId": "glyph-rain.defaults", "theme": {}, "global": {"speed": 1, "delayOffset": 0, "easing": "ease-out-cubic"}, "elements": [], "extras": {"cell": 15, "charset": "ｱｲｳｴｵｶｷｸｹｺｻｼｽｾｿﾀﾁﾂﾃﾄﾅﾆﾇﾈﾉﾊﾋﾌﾍﾎﾏﾐﾑﾒﾓﾔﾕﾖﾗﾘﾙﾚﾛﾜﾝ0123456789Z*+-<>¦=:.", "glyphColor": "#4474FF", "headColor": "#2B6AFF", "speed": 0.2, "speedVariance": 0.5, "density": 0.15, "trail": 0.65, "glow": 1.75, "mutate": 0, "flicker": 0, "layers": 2, "dim": 0.5, "columnCountCap": 220, "deterministicSeed": 1, "fadeInFrames": 0, "fadeOutFrames": 0}}